{
  "title": "Christmas Song 1",
  "blueprint_ref": {
    "genre": "Christmas",
    "version": "2025.11"
  },
  "style": {
    "genre_detail": {
      "primary": "christmas",
      "subgenres": [],
      "fusions": []
    },
    "tempo_bpm": 80,
    "time_signature": "4/4",
    "key": {
      "primary": "C major",
      "modulations": []
    },
    "mood": [
      "joyful",
      "festive"
    ],
    "energy": "medium",
    "instrumentation": [
      "bells",
      "orchestra",
      "choir"
    ],
    "vocal_profile": "standard",
    "tags": [
      "festive",
      "joyful"
    ],
    "negative_tags": []
  },
  "lyrics": {
    "language": "en",
    "pov": "1st",
    "tense": "present",
    "themes": [
      "christmas",
      "life",
      "emotion"
    ],
    "rhyme_scheme": "ABAB",
    "section_order": [
      "verse1",
      "chorus1",
      "verse2",
      "chorus2",
      "bridge",
      "chorus3"
    ],
    "constraints": {
      "explicit": false,
      "max_lines": 35
    }
  },
  "producer_notes": {
    "structure": "Standard",
    "hooks": 2
  },
  "sources": [],
  "prompt_controls": {},
  "render": {
    "engine": "none"
  },
  "seed": 6000
}