{
  "title": "Dance All Night",
  "blueprint_ref": {
    "genre": "Pop",
    "version": "2025.11"
  },
  "style": {
    "genre_detail": {
      "primary": "pop",
      "subgenres": [
        "dance-pop"
      ],
      "fusions": []
    },
    "tempo_bpm": 128,
    "time_signature": "4/4",
    "key": {
      "primary": "G major",
      "modulations": []
    },
    "mood": [
      "energetic",
      "joyful"
    ],
    "energy": "anthemic",
    "instrumentation": [
      "synth",
      "electronic drums",
      "bass"
    ],
    "vocal_profile": "strong",
    "tags": [
      "uplifting",
      "anthemic"
    ],
    "negative_tags": []
  },
  "lyrics": {
    "language": "en",
    "pov": "1st",
    "tense": "present",
    "themes": [
      "dancing",
      "nightlife",
      "freedom"
    ],
    "rhyme_scheme": "AABB",
    "section_order": [
      "verse1",
      "chorus1",
      "verse2",
      "chorus2",
      "chorus3"
    ],
    "constraints": {
      "explicit": false,
      "max_lines": 30
    }
  },
  "producer_notes": {
    "structure": "Verse-Chorus-Verse-Chorus-Chorus",
    "hooks": 4
  },
  "sources": [],
  "prompt_controls": {},
  "render": {
    "engine": "none"
  },
  "seed": 100
}