{
  "title": "Rock Song 5",
  "blueprint_ref": {
    "genre": "Rock",
    "version": "2025.11"
  },
  "style": {
    "genre_detail": {
      "primary": "rock",
      "subgenres": [],
      "fusions": []
    },
    "tempo_bpm": 160,
    "time_signature": "4/4",
    "key": {
      "primary": "E major",
      "modulations": []
    },
    "mood": [
      "rebellious",
      "energetic"
    ],
    "energy": "medium",
    "instrumentation": [
      "guitar",
      "bass",
      "drums"
    ],
    "vocal_profile": "standard",
    "tags": [
      "guitar-driven",
      "powerful"
    ],
    "negative_tags": []
  },
  "lyrics": {
    "language": "en",
    "pov": "1st",
    "tense": "present",
    "themes": [
      "rock",
      "life",
      "emotion"
    ],
    "rhyme_scheme": "ABAB",
    "section_order": [
      "verse1",
      "chorus1",
      "verse2",
      "chorus2",
      "bridge",
      "chorus3"
    ],
    "constraints": {
      "explicit": false,
      "max_lines": 35
    }
  },
  "producer_notes": {
    "structure": "Standard",
    "hooks": 6
  },
  "sources": [],
  "prompt_controls": {},
  "render": {
    "engine": "none"
  },
  "seed": 1040
}