{
  "title": "Hiphop Song 3",
  "blueprint_ref": {
    "genre": "Hiphop",
    "version": "2025.11"
  },
  "style": {
    "genre_detail": {
      "primary": "hiphop",
      "subgenres": [],
      "fusions": []
    },
    "tempo_bpm": 85,
    "time_signature": "4/4",
    "key": {
      "primary": "G minor",
      "modulations": []
    },
    "mood": [
      "confident",
      "aggressive"
    ],
    "energy": "medium",
    "instrumentation": [
      "beats",
      "bass",
      "synth"
    ],
    "vocal_profile": "standard",
    "tags": [
      "rhythmic",
      "bass-heavy"
    ],
    "negative_tags": []
  },
  "lyrics": {
    "language": "en",
    "pov": "1st",
    "tense": "present",
    "themes": [
      "hiphop",
      "life",
      "emotion"
    ],
    "rhyme_scheme": "ABAB",
    "section_order": [
      "verse1",
      "chorus1",
      "verse2",
      "chorus2",
      "bridge",
      "chorus3"
    ],
    "constraints": {
      "explicit": false,
      "max_lines": 35
    }
  },
  "producer_notes": {
    "structure": "Standard",
    "hooks": 4
  },
  "sources": [],
  "prompt_controls": {},
  "render": {
    "engine": "none"
  },
  "seed": 2020
}