{
  "title": "Hyperspeed",
  "blueprint_ref": {
    "genre": "Electronic",
    "version": "2025.11"
  },
  "style": {
    "genre_detail": {
      "primary": "drum and bass",
      "subgenres": [],
      "fusions": []
    },
    "tempo_bpm": 200,
    "time_signature": "4/4",
    "key": {
      "primary": "E minor",
      "modulations": []
    },
    "mood": [
      "frantic",
      "intense"
    ],
    "energy": "anthemic",
    "instrumentation": [
      "electronic drums",
      "bass",
      "synth"
    ],
    "vocal_profile": "energetic",
    "tags": [
      "fast",
      "intense"
    ],
    "negative_tags": []
  },
  "lyrics": {
    "language": "en",
    "pov": "1st",
    "tense": "present",
    "themes": [
      "speed",
      "adrenaline"
    ],
    "rhyme_scheme": "AAAA",
    "section_order": [
      "verse1",
      "chorus1",
      "verse2",
      "chorus2"
    ],
    "constraints": {
      "explicit": false,
      "max_lines": 25
    }
  },
  "producer_notes": {
    "structure": "Fast-paced",
    "hooks": 4
  },
  "sources": [],
  "prompt_controls": {},
  "render": {
    "engine": "none"
  },
  "seed": 9100
}